{
  "schema_version": "0.1.0",
  "record_id": "paper.arxiv.1803.09010",
  "work": {
    "id": "paper.arxiv.1803.09010",
    "title": "Datasheets for Datasets",
    "identifiers": [
      {
        "scheme": "arxiv",
        "value": "1803.09010",
        "scope": "work"
      },
      {
        "scheme": "doi",
        "value": "10.48550/arxiv.1803.09010",
        "scope": "work"
      }
    ],
    "aliases": []
  },
  "manifestation": {
    "id": "manifestation.arxiv.1803.09010",
    "kind": "preprint",
    "canonical_url": "https://arxiv.org/abs/1803.09010v8",
    "publisher": "arXiv"
  },
  "revision": {
    "id": "paper.arxiv.1803.09010.v8",
    "work_id": "paper.arxiv.1803.09010",
    "version_label": "v8",
    "identifiers": [
      {
        "scheme": "arxiv",
        "value": "1803.09010v8",
        "scope": "revision"
      }
    ],
    "first_submitted_on": "2018-03-23",
    "revised_on": "2021-12-01"
  },
  "authors": [
    {
      "display_name": "Timnit Gebru",
      "entity_id": null,
      "identity_status": "unresolved",
      "affiliations": []
    },
    {
      "display_name": "Jamie Morgenstern",
      "entity_id": null,
      "identity_status": "unresolved",
      "affiliations": []
    },
    {
      "display_name": "Briana Vecchione",
      "entity_id": null,
      "identity_status": "unresolved",
      "affiliations": []
    },
    {
      "display_name": "Jennifer Wortman Vaughan",
      "entity_id": null,
      "identity_status": "unresolved",
      "affiliations": []
    },
    {
      "display_name": "Hanna Wallach",
      "entity_id": null,
      "identity_status": "unresolved",
      "affiliations": []
    },
    {
      "display_name": "Hal Daumé III",
      "entity_id": null,
      "identity_status": "unresolved",
      "affiliations": []
    },
    {
      "display_name": "Kate Crawford",
      "entity_id": null,
      "identity_status": "unresolved",
      "affiliations": []
    }
  ],
  "research_domains": [
    "machine-learning",
    "datasets",
    "research-governance"
  ],
  "research_method": "methodology_proposal",
  "summary": {
    "text": "Proposes structured documentation that helps dataset creators describe a dataset and helps users assess its intended use.",
    "origin": "original_editorial_summary",
    "scope": "Brief description derived from landing-page subject matter; no empirical outcome asserted."
  },
  "source_refs": [
    "source.arxiv.1803.09010.v8"
  ],
  "field_evidence": [
    {
      "field": "/work/title",
      "source_id": "source.arxiv.1803.09010.v8",
      "locator": "Title",
      "check_id": "check.arxiv.1803.09010.v8",
      "scope": "bibliographic_metadata"
    },
    {
      "field": "/work/identifiers",
      "source_id": "source.arxiv.1803.09010.v8",
      "locator": "Cite as and arXiv-issued DOI",
      "check_id": "check.arxiv.1803.09010.v8",
      "scope": "bibliographic_metadata"
    },
    {
      "field": "/manifestation",
      "source_id": "source.arxiv.1803.09010.v8",
      "locator": "Version-specific landing URL",
      "check_id": "check.arxiv.1803.09010.v8",
      "scope": "bibliographic_metadata"
    },
    {
      "field": "/revision",
      "source_id": "source.arxiv.1803.09010.v8",
      "locator": "Submission history",
      "check_id": "check.arxiv.1803.09010.v8",
      "scope": "bibliographic_metadata"
    },
    {
      "field": "/authors",
      "source_id": "source.arxiv.1803.09010.v8",
      "locator": "Authors",
      "check_id": "check.arxiv.1803.09010.v8",
      "scope": "bibliographic_metadata"
    },
    {
      "field": "/summary/text",
      "source_id": "source.arxiv.1803.09010.v8",
      "locator": "Landing-page subject matter; original summary",
      "check_id": null,
      "scope": "original_summary"
    },
    {
      "field": "/research_domains",
      "source_id": "source.arxiv.1803.09010.v8",
      "locator": "Subjects; provisional editorial classification",
      "check_id": null,
      "scope": "editorial_classification"
    },
    {
      "field": "/research_method",
      "source_id": "source.arxiv.1803.09010.v8",
      "locator": "Abstract scope; provisional editorial classification",
      "check_id": null,
      "scope": "editorial_classification"
    }
  ],
  "upstream_refs": [
    {
      "repository": "Pick-Your-AI/pick-your-ai-research",
      "commit": "da3d320e239a6d37a933963230f2eb3643d1d5c4",
      "path": "research/T5-training-fine-tuning/training-dataset.md",
      "source_id": "T22"
    }
  ],
  "claims": [],
  "citation_verification": "metadata_checked",
  "citation_check_ids": [
    "check.arxiv.1803.09010.v8"
  ],
  "scientific_validity": "not_assessed",
  "evidence_confidence": "not_assessed",
  "scientific_review_ids": [],
  "reproducibility_status": "not_attempted",
  "experiment_ids": [],
  "reproduction_review_ids": [],
  "integrity_status": "not_assessed",
  "integrity_check_ids": [],
  "integrity_event_ids": [],
  "editorial_status": "proposal",
  "editorial_review_ids": [],
  "rights_status": "unknown",
  "rights_decision_ids": [
    "rights.arxiv.1803.09010.v8"
  ],
  "publication_status": "withheld",
  "publication_fields": [
    "/work/title",
    "/work/identifiers",
    "/manifestation",
    "/revision",
    "/authors",
    "/summary/text",
    "/research_domains",
    "/research_method"
  ],
  "publication_operations": [
    "display",
    "export"
  ],
  "publication_receipt_id": null,
  "limitations": [
    "The arXiv DOI identifies the arXiv work; no publisher DOI equivalence was verified.",
    "Author names are transcribed metadata; author entities, affiliations and laboratories remain unresolved.",
    "Paper scientific validity, independent reproduction and correction/retraction history are not assessed.",
    "Metadata proposals are withheld from publication pending source-use and independent editorial review."
  ]
}
